"Sorgho ensilage, moyenne nationale, alimentation animale, à la ferme / FR U",conv,1,Agricultural\Plant production\Roughage\Transformation,0.06332701140405458,0.19187186807071277,0.1582593013797804,0.1029738271311487,0.12300764245389406,0.4691889624172653,0.22751307517301647,0.12681261613687297,Fibre,1.4629543041667454
"Poireau conventionnel, automne irrigué, à la ferme / FR U",conv,1,Agricultural\Plant production\Vegetables\Transformation,0.21784650912838205,0.49764849576557824,0.41089868653718703,0.07196524720392034,0.17150631616377116,0.10147500601482087,0.12326735769123716,0.3024814062856892,Légume,1.8970890247905858
"Carotte conventionnelle de saison, avec l'empreinte eau, à la ferme / FR U",conv,1,Agricultural\Plant production\Vegetables\Transformation,0.02241260219892813,0.07694068490125508,0.06207632512323945,0.059667410531301375,0.06736264849354694,0.06751947349160445,0.030024324131401804,0.06256607994309772,Légume,0.448569548814375
"Carotte conventionnelle, moyenne nationale, à la ferme / FR U",conv,1,Agricultural\Plant production\Vegetables\Transformation,0.03317132496476733,0.10296364259676602,0.06278959724720727,0.028789906511854795,0.03314542496741648,0.0681854273773813,0.06042371364046606,0.023986585426552815,Légume,0.41345562273241204
"Chou-fleur conventionnel, moyenne nationale, à la ferme / FR U",conv,1,Agricultural\Plant production\Vegetables\Transformation,0.13991890921998043,0.24326195017894628,0.2003864279942967,0.10544271569065351,0.13616343848991508,0.07593358013111633,0.2167280550487705,0.15849149774178845,Légume,1.2763265744954673
"Chou-fleur mix conventionnel et biologique, moyenne nationale, à la ferme / FR U",conv,1,Agricultural\Plant production\Vegetables\Transformation,0.14092340310369067,0.24402199406671096,0.2021233988204258,0.10770319374781895,0.13845158551609402,0.07636783130274424,0.21852092153050892,0.16034277771961666,Légume,1.2884551058076104
"Chou-fleur conventionnel, culture d'été, à la ferme / FR U",conv,1,Agricultural\Plant production\Vegetables\Transformation,0.08902409093430366,0.1894975179979153,0.1682569340544469,0.03721224532736746,0.054679526208368114,0.06336769696789779,0.16820967599518513,0.061007200758448184,Légume,0.8312548882439326
"Chou-fleur conventionnel, culture d'hiver, à la ferme / FR U",conv,1,Agricultural\Plant production\Vegetables\Transformation,0.14712319857011255,0.25087244059688324,0.20493443855593432,0.11510091012600035,0.14769769091307092,0.07771231244792572,0.22359595345398314,0.17229064480387452,Légume,1.3393275894677847
"Endive conventionnelle, moyenne nationale, à la ferme / FR U",conv,1,Agricultural\Plant production\Vegetables\Transformation,0.17676161286479142,1.4923583008984653,0.20083312737437062,0.07376958007889106,0.08103281354049746,0.21178985143396495,0.1401852029211361,0.07165979076053161,Légume,2.448390279872649
"Endive conventionnelle, précoce, à la ferme / FR U",conv,1,Agricultural\Plant production\Vegetables\Transformation,0.18299355827312733,1.4422139238052702,0.24749415765164595,0.04180226001715355,0.052630165308640314,0.21671702209567342,0.1580470854987307,0.04257426452496673,Légume,2.384472437175208
"Production de racine d'endive conventionnelle, précoce, à la ferme FR U",conv,1,Agricultural\Plant production\Vegetables\Transformation,0.054638988740495206,0.19506293922313883,0.14427665213810087,0.011710753654453078,0.023793373220840748,0.07346746630393117,0.10752985801544603,0.021940629669755844,Légume,0.6324206609661618
"Conservation des racines d'endive et forçage, précoce, à la ferme FR U",conv,1,Agricultural\Plant production\Vegetables\Transformation,0.10786494875494645,1.174002382373454,0.04911376096175726,0.025699973742280564,0.019914277129984285,0.11569925592776813,0.01019353072749242,0.012405898729052444,Légume,1.5148940283467356
"Endive conventionnelle, tardive, à la ferme / FR U",conv,1,Agricultural\Plant production\Vegetables\Transformation,0.18631431088476158,1.6492049352490725,0.20663589806363233,0.09041545612150155,0.09635534507549298,0.24488025894604143,0.14555049020912456,0.0850712203667993,Légume,2.704427914916426
"Production de racine d'endive conventionnelle, tardive, à la ferme FR U",conv,1,Agricultural\Plant production\Vegetables\Transformation,0.03911359122982881,0.11598989018270114,0.08263341067680234,0.03159718043065787,0.040294198071695216,0.04649973324847765,0.07879686088899565,0.04077982032535326,Légume,0.47570468505451197
"Conservation des racines d'endive et forçage, tardive, à la ferme FR U",conv,1,Agricultural\Plant production\Vegetables\Transformation,0.12053236199823134,1.4541310290327123,0.06766152556173759,0.03727474357903147,0.028587830136732818,0.1666761621190562,0.013028496895813767,0.016486977092341537,Légume,1.904379126415657
"Endive, mix conventionnel et biologique, moyenne nationale, à la ferme FR U",conv,1,Agricultural\Plant production\Vegetables\Transformation,0.1783446729459283,1.5014754133340409,0.2027147564467116,0.07349029456642481,0.0808978453391871,0.21309359858785612,0.14160455404247058,0.07148964094717838,Légume,2.463110776209798
"Endive conventionnelle, saison, à la ferme / FR U",conv,1,Agricultural\Plant production\Vegetables\Transformation,0.16409294214065334,1.3605838550944536,0.17169984154647072,0.07310736406714932,0.07991160612143046,0.17623585859103433,0.12588897434435015,0.07279112427204629,Légume,2.2243115661775885
"Conservation des racines d'endive et forçage, saison, fluide NH3, à la ferme / FR U",conv,1,Agricultural\Plant production\Vegetables\Transformation,0.04122837838219021,0.5223151078491308,0.048874324741677556,0.026445540761847127,0.02042120236833851,0.10823707461059703,0.009095437227281572,0.012674133037776876,Légume,0.7892911989788397
"Production de racine d'endive conventionnelle, saison, à la ferme FR U",conv,1,Agricultural\Plant production\Vegetables\Transformation,0.04256835054034233,0.12622429225764534,0.08992459397181429,0.03438516693924535,0.04384956848978599,0.04963123000410532,0.08586035866851921,0.044378039765825605,Légume,0.5168216006372834
"Conservation des racines d'endive et forçage, saison, à la ferme FR U",conv,1,Agricultural\Plant production\Vegetables\Transformation,0.10619998540578778,1.1889188176240562,0.04940239374480335,0.02634353702977565,0.02027619297532151,0.10873738578545109,0.009118886555164008,0.012436990190523455,Légume,1.5214341893108827
"fibres de noix de coco, à l'entrepôt régional / FR U",conv,1,Agricultural\Plant production\Vegetables\Transformation,0.17996631480587783,0.48786207604238924,0.5362071155233543,0.07584755222826564,0.15537580812877533,0.09306924669858324,0.060646110060797315,0.07818857531250113,Légume,1.6671627988005437
"Poireau conventionnel, précoce planté, à la ferme / FR U",conv,1,Agricultural\Plant production\Vegetables\Transformation,0.20992664382951978,0.42055485414902694,0.3682092778182518,0.0783454804037393,0.16866500320319086,0.12655420827834504,0.11125631498356173,0.28051322771745923,Légume,1.7640250103830946
"Poireau conventionnel, précoce semé, à la ferme / FR U",conv,1,Agricultural\Plant production\Vegetables\Transformation,0.1995684192025462,0.40769076793854364,0.33891837213849313,0.07761569403761714,0.16643674539423292,0.1309569588577795,0.11641051235844103,0.2735774623272147,Légume,1.7111749322548684
"Poireau conventionnel, moyenne nationale, à la ferme",conv,1,Agricultural\Plant production\Vegetables\Transformation,0.15273288711329763,0.3749603165955853,0.30718329292916313,0.059286508967102323,0.12100401885726636,0.08902465979894704,0.11070910322867025,0.1900998725378064,Légume,1.4050006600278384
"Poireau conventionnel, hiver non irrigué, à la ferme / FR U",conv,1,Agricultural\Plant production\Vegetables\Transformation,0.10309138184796707,0.3035486998813234,0.23997891243656483,0.04664598639838799,0.08087921719614558,0.06939810292896201,0.10442696890536218,0.10664419276743559,Légume,1.0546134623621486
"Laitue conventionnelle, automne sous tunnel, à la ferme / FR U",conv,1,Agricultural\Plant production\Vegetables\Transformation,0.05737556812486306,0.1115635861665586,0.09304688059825612,0.03640436177748037,0.03964555906371332,0.08863695467062524,0.024757749064940795,0.043134304911149154,Légume,0.4945649643775866
"Laitue conventionnelle, moyenne nationale, à la ferme / FR U",conv,1,Agricultural\Plant production\Vegetables\Transformation,0.08683527918116678,0.1809838036812071,0.15381013769082175,0.040317047304057364,0.06415602744008642,0.08589578321083217,0.04593757554211374,0.09551720265516926,Légume,0.7534528567054546
"Laitue conventionnelle, plein champ, à la ferme / FR U",conv,1,Agricultural\Plant production\Vegetables\Transformation,0.11447823429312873,0.2620787504677244,0.21577962341401138,0.037256613436203706,0.08882813484473255,0.06090125787945314,0.07082866533963952,0.1576577506477745,Légume,1.0078090303226677
"Laitue conventionnelle, hiver sous tunnel, à la ferme / FR U",conv,1,Agricultural\Plant production\Vegetables\Transformation,0.07417876873781352,0.12463940389061935,0.12018729114566937,0.049075553641128804,0.051068427174622504,0.12192093840366333,0.028859793318907822,0.05300452720923932,Légume,0.622934703521664
"Melon conventionel, moyenne nationale, à la ferme / FR U",conv,1,Agricultural\Plant production\Vegetables\Transformation,0.0877454930378027,0.23854893754809808,0.19784355551969138,0.041422177853495154,0.05247513039100361,0.22395657196968052,0.15834691564384923,0.045904586327096236,Légume,1.0462433682907168
"Melon mix conventionnel et biologique, moyenne nationale, à la ferme / FR U",conv,1,Agricultural\Plant production\Vegetables\Transformation,0.087611901502976,0.23837385625624366,0.19784015595251728,0.04131076376846806,0.05240884412942224,0.2242193801678328,0.15865994720814625,0.04586752565008459,Légume,1.0462923746356911
"Melon conventionnel, plein champ, à la ferme / FR U",conv,1,Agricultural\Plant production\Vegetables\Transformation,0.0759292860674033,0.2207858626530704,0.17683288296508795,0.035316979360717204,0.04571900081026073,0.21650056921824085,0.1589598363196469,0.03895736427422364,Légume,0.9690017816686509
"Melon conventionnel, sous tunnel, à la ferme / FR U",conv,1,Agricultural\Plant production\Vegetables\Transformation,0.16452353443339113,0.35968102383519884,0.3367920706390343,0.08627376892679633,0.10425472728697101,0.2314659223043145,0.08157686417408712,0.1099122961491312,Légume,1.4744802077489243
"Melon conventionnel, sous chenille, à la ferme / FR U",conv,1,Agricultural\Plant production\Vegetables\Transformation,0.13064230972067298,0.2990187191756134,0.27241278699731075,0.05994337989607244,0.07146249602294077,0.27980218036561616,0.20728924572572777,0.05786253160155608,Légume,1.3784336495055105
"Bubilles d'oignon conventionnels, au site de production / FR U",conv,1,Agricultural\Plant production\Vegetables\Transformation,0.9063575664238406,3.9217185074308825,1.9660362113069754,0.5681210194322345,0.7096970821927072,2.799311544833106,4.433221974882741,0.5598781087843382,Légume,15.864342015286825
"Oignon conventionnel, jour long planté, à la ferme / FR U",conv,1,Agricultural\Plant production\Vegetables\Transformation,0.06433189991823267,0.2639606952738914,0.14228807942836963,0.041203774499076605,0.05148836273205598,0.20240348827005317,0.27841318894343275,0.040791227629437835,Légume,1.08488071669455
"Oignon conventionnel, jour long semé, à la ferme / FR U",conv,1,Agricultural\Plant production\Vegetables\Transformation,0.023845259680093833,0.1072710794070642,0.05372450030576536,0.015557765196914274,0.01942455704361781,0.08061035259486884,0.08603689473970999,0.015313480646597145,Légume,0.40178388961463146
"Oignon conventionnel, moyenne nationale, à la ferme / FR U",conv,1,Agricultural\Plant production\Vegetables\Transformation,0.028346971743953186,0.12228383228287405,0.06375404277508849,0.018424451117303946,0.02302889769258088,0.09352933155356709,0.10634367812635617,0.018205249625200162,Légume,0.47391645491692397
"Oignon conventionnel, jour court semé, à la ferme / FR U ",conv,1,Agricultural\Plant production\Vegetables\Transformation,0.02837573949162616,0.10070899039648142,0.06545634422359736,0.018578614837656587,0.02340415744439169,0.08800700561134694,0.09672843244802465,0.01875342308205583,Légume,0.4400127075351806
"Courgette conventionnelle, automne sous tunnel, à la ferme / FR U",conv,1,Agricultural\Plant production\Vegetables\Transformation,0.14789963371364548,0.28206775928972894,0.275204885157381,0.08215026419013337,0.10631592379319989,0.1710722649446409,0.0659210873953603,0.12704311276972605,Légume,1.257674931253816
"Courgette conventionnelle, moyenne nationale, à la ferme / FR U",conv,1,Agricultural\Plant production\Vegetables\Transformation,0.07718410194284342,0.1781427439326135,0.1617608741825764,0.03887341729920181,0.0507114230341297,0.10777133578152852,0.08378804440071498,0.054106593971160556,Légume,0.752338534544769
"Courgette mix conventionnel et biologique, moyenne nationale, à la ferme / FR U",conv,1,Agricultural\Plant production\Vegetables\Transformation,0.07733866490241492,0.1779596268420474,0.16145613638761636,0.03898016821067913,0.05086226584510127,0.10760828436213432,0.08282139846663306,0.054479875716142746,Légume,0.7515064207327692
"Courgette conventionnelle, plein champ, à la ferme / FR U",conv,1,Agricultural\Plant production\Vegetables\Transformation,0.0641264136338947,0.18167258500781813,0.16364361709626776,0.026901330402304847,0.038230926957787806,0.10860885450279875,0.12481334044779317,0.03530217539552859,Légume,0.7432992434441937
"Courgette conventionnelle, printemps sous tunnel, à la ferme / FR U",conv,1,Agricultural\Plant production\Vegetables\Transformation,0.0810391297701336,0.1561036163321217,0.14010581246719556,0.04608706901823376,0.05644131725342134,0.09594774977942504,0.03681049822503181,0.06459021467466303,Légume,0.6771254075202258
"Fraise conventionnelle, moyenne nationale, à la ferme / FR U",conv,1,Agricultural\Plant production\Vegetables\Transformation,0.546785434945655,1.4422209657268552,0.5485478262231648,0.27825185215469367,0.2098798162281723,1.5246185784618287,0.2007684302314014,0.15499730903731349,Légume,4.906070213009085
"Fraise conventionnelle, plein champ, à la ferme / FR U",conv,1,Agricultural\Plant production\Vegetables\Transformation,0.08724451057115176,0.2569112673294484,0.18223274904685047,0.1499122306971827,0.16663918600622965,0.18017304041908547,0.2769145637356645,0.16402852997292963,Légume,1.4640560777785425
"Fraise conventionnelle, sol sous abri non chauffé, à la ferme / FR U",conv,1,Agricultural\Plant production\Vegetables\Transformation,0.24505611602050958,0.348991153077241,0.34887907282247027,0.16598892481653316,0.13866586467771105,0.481150720107418,0.048647646697526054,0.10335096686130389,Légume,1.880730465080713
"Fraise conventionnelle, hors sol sous abri anti gel, à la ferme / FR U",conv,1,Agricultural\Plant production\Vegetables\Transformation,0.44750506242588434,1.1862358508813486,0.47539546222432894,0.20568221377582582,0.18476489055749645,1.885219541998339,0.19418673075227463,0.1292962071990322,Légume,4.70828595981453
"Fraise conventionnelle, hors sol sous abri chauffé, à la ferme / FR U",conv,1,Agricultural\Plant production\Vegetables\Transformation,1.580964011576704,4.8906375847575365,1.2376308921643306,0.6530613368499902,0.38264414647148465,2.5357937853756436,0.3073965199148659,0.257612007807253,Légume,11.84574028491781
"Fraise conventionnelle, hors sol sous abri non chauffé, à la ferme / FR U",conv,1,Agricultural\Plant production\Vegetables\Transformation,0.36535674065589524,0.5458399905871542,0.5018783790767004,0.2453250710807907,0.21152372032741903,3.371247621811083,0.347904121693499,0.16178450508366496,Légume,5.750860150316206
"Tomate conventionnelle, panier moyen, serre chauffée, moyenne nationale, à la ferme / FR U",conv,1,Agricultural\Plant production\Vegetables\Transformation,1.2412920422839326,4.194870809087173,0.623600041246324,0.2615669223564963,0.19323315189905785,1.4820368089944747,0.1915834818565975,0.10362952597739827,Légume,8.291812783701454
"Tomate conventionnelle, panier moyen, sol sous abri non chauffé, moyenne nationale, à la ferme / FR U",conv,1,Agricultural\Plant production\Vegetables\Transformation,0.07817764079951499,0.20288330314221859,0.08348446850071621,0.04252174956827099,0.04318931176022666,0.08442686541207352,0.019388364673398478,0.03950442699423648,Légume,0.593576130850656
"Tomate conventionnelle, serre semi fermée, énergie fatale et biomasse, sans CO2 liquide, avec recyclage des drainages, à la ferme / FR U",conv,1,Agricultural\Plant production\Vegetables\Transformation,0.10860670422733557,0.416317423660714,0.2621818853426222,0.24226805418827932,0.06680676538256508,0.38617570581374433,0.044586018071374404,0.05214706760692034,Légume,1.5790896242935553
"Tomate conventionnelle, serre semi fermée, énergie fatale et biomasse, avec CO2 liquide, avec recyclage des drainages, à la ferme / FR U",conv,1,Agricultural\Plant production\Vegetables\Transformation,0.3125092989105793,0.5949573246931179,0.32690029141376553,0.23743049518402862,0.10069506974035639,0.7322308440032957,0.054671988827322215,0.06476869518880837,Légume,2.424164007961274
"Tomate conventionnelle, serre récente, biomasse et gaz naturel, recyclage des drainages, à la ferme / FR U",conv,1,Agricultural\Plant production\Vegetables\Transformation,0.39354289756947525,0.6778190699179851,0.9065254068007267,0.9660065574783935,0.16881838053173218,0.7834969382695158,0.11670140770791212,0.1458363401681758,Légume,4.158746998443916
"Tomate conventionnelle, serre récente, gaz naturel, sans recyclage des drainages, à la ferme / FR U",conv,1,Agricultural\Plant production\Vegetables\Transformation,0.8671389481158863,2.8189127176343294,0.38955783701600866,0.09275839564560433,0.09632205673628913,1.8852562186726267,0.17938413154321364,0.07308900288142392,Légume,6.402419308245381
"Tomate conventionnelle, serre récente, gaz naturel, sans recyclage des drainages, empreinte eau, à la ferme / FR U",conv,1,Agricultural\Plant production\Vegetables\Transformation,0.8671389481158863,2.8189127176343294,0.38955783701600866,0.09275839564560433,0.09632205673628913,1.8852562186726267,0.17938413154321364,0.07308900288142392,Légume,6.402419308245381
"Tomate conventionnelle, serre récente, gaz naturel, avec recyclage des drainages, à la ferme / FR U",conv,1,Agricultural\Plant production\Vegetables\Transformation,0.8494639981472377,2.8009479324113205,0.37183940240460905,0.08283538327930197,0.0859473923118824,0.3601228845043079,0.05368417486393218,0.06373300005183816,Légume,4.6685741679744295
"Tomate conventionnelle, serre récente, gaz naturel, avec recyclage des drainages, empreinte eau, à la ferme / FR U",conv,1,Agricultural\Plant production\Vegetables\Transformation,0.8494639981472377,2.8009479324113205,0.37183940240460905,0.08283538327930197,0.0859473923118824,0.3601228845043079,0.05368417486393218,0.06373300005183816,Légume,4.6685741679744295
"Tomate conventionnelle, serre récente, énergie fatale et gaz naturel, avec recyclage des drainages, à la ferme / FR U",conv,1,Agricultural\Plant production\Vegetables\Transformation,0.3412600355965795,0.8013398326599648,0.21538664873235439,0.08272630862175023,0.07525305673915442,0.5491936382488678,0.040492862824366545,0.04679912433252535,Légume,2.152451507755563
"Tomate conventionnelle, serre ancienne, gaz naturel, sans recyclage des drainage, à la ferme /FR U",conv,1,Agricultural\Plant production\Vegetables\Transformation,1.0365040490423814,3.3162150566935957,0.47337764835266766,0.11969382436852968,0.12070414368475481,7.6788717096054535,0.6555490467715076,0.0910516512976004,Légume,13.49196712981649
"Tomate conventionnelle, calibre intermédiaire, sous abri chauffé, à la ferme",conv,1,Agricultural\Plant production\Vegetables\Transformation,0.8793076396409085,2.971566580343081,0.44174639160719764,0.18528902574196263,0.13688268437564272,1.0498466533732045,0.13571409013831115,0.0734091824510663,Légume,5.873762247671373
"Tomate conventionnelle, calibre inermédiaire, sol sous abri non chauffé, à la ferme / FR U",conv,1,Agricultural\Plant production\Vegetables\Transformation,0.07538219788892486,0.19562868806016365,0.08049926629372094,0.041001274886738874,0.041644966673042794,0.08140796537612666,0.01869508375477393,0.03809184445323044,Légume,0.5723512873867221
"Tomate mix conventionnel et biologique, sous abri, moyenne nationale, à la ferme / FR U",conv,1,Agricultural\Plant production\Vegetables\Transformation,1.2242913431271931,4.135721325642539,0.616156103272655,0.2583711414784938,0.1912220480398388,1.4614418475262647,0.18905962877599045,0.10312380120564911,Légume,8.179387239068625
"Albacore, AEN, chalut pélagique, en moyenne, à l'atterrissage / FR U",conv,0,Fishery\Fishery products\Albacore - NEA - Pelagic Trawl,2.2325723307686536,10.360517160800208,18.85870612334733,4.663923908915548,4.948265631300391,0.4500053861933881,2.407510207724772,3.042518683402828,Autre,46.964019432453114
"Thon rouge, MEDSEA, palangre, en moyenne, à l'atterrissage / FR U",conv,0,Fishery\Fishery products\Bluefin Tuna - MedSea - Longline,0.9487511612315479,3.6435042845784595,6.451111327235742,1.6406647672910375,1.7410351207412904,1.4529517918466286,0.8258684582441614,1.0342634193640978,Autre,17.738150330532964
"Thon rouge, MEDSEA, Seine, en moyenne, à la  de la cage / FR U",conv,0,Fishery\Fishery products\Bluefin Tuna - MedSea - Seine,0.5572071984385526,1.993872801399456,3.4673548678156814,0.8885289103855694,0.9450298017475245,1.4037593518729337,0.4456836596538754,0.5547130173307184,Autre,10.25614960864431
"Sole commune, BBiscay, trémail, en moyenne, à l'atterrissage / FR U",conv,0,Fishery\Fishery products\Common Sole - BBiscay - Trammel Net,1.1397103293859232,4.714470219334217,8.544723714246194,2.1261320289831547,2.2614474590793043,0.6452829632634942,1.093346731118782,1.3730320623656742,Autre,21.89814550777674
"Anchois européenne, la CEA, la Seine, en moyenne, à l'atterrissage / MA U",conv,0,Fishery\Fishery products\European Anchovy - ECA - Seine,0.2364563337411663,1.0470647695961925,1.9181743311065738,0.47868436392466235,0.5063881032144297,0.1527333786235518,0.24572217066217353,0.30964226152134267,Autre,4.894865712390093
"Sardine européenne, BBiscay, Seine, en moyenne, à l'atterrissage / FR U",conv,0,Fishery\Fishery products\European Pilchard - BBiscay - Seine,0.18125121968858193,0.8183492579810319,1.4717871302243515,0.36465325352741124,0.38751002148823754,0.0727317432684005,0.18782396568831514,0.23688319929638374,Autre,3.7209897911627134
"Sardine européenne, la CEA, la Seine, en moyenne, à l'atterrissage / FR U",conv,0,Fishery\Fishery products\European Pilchard - ECA -Seine,0.07330292268310849,0.33089749605566693,0.607427399578403,0.15100397454687686,0.15985937168417674,0.029994921898132756,0.07770874920748469,0.09807291692239645,Autre,1.5282677525762456
"Saithe, Mer du Nord, Chalut de fond, en moyenne, frais, à l'atterrissage / UE U",conv,0,Fishery\Fishery products\Fresh Saithe - NorthSea - Bottom Trawl,1.1017224488734285,5.308543028214524,9.042008728743937,2.2420528257949117,2.3746819041612044,0.3241812571727307,1.1549845031459354,1.459932455134906,Autre,23.008107151241582
"Saithe, Mer du Nord, Chalut de fond, en moyenne, congelés, à l'atterrissage / FR U",conv,0,Fishery\Fishery products\Frozen Saithe - NorthSea - Bottom Trawl,2.259455282734034,12.247534339743419,17.520040865815478,4.341854760605964,4.598927569275157,0.5656431714668232,2.235665489872618,2.826023563805868,Autre,46.595145043319356
"Gadidae, Mer Celtique, chalut de fond, en moyenne, à l'atterrissage / FR U",conv,0,Fishery\Fishery products\Gadidae - CelticSea - Bottom Trawl,1.7387396018576515,7.8859485871853146,14.348726622341585,3.5587183180976196,3.7638784600627777,0.44733709216702616,1.829945097503686,2.3130047815377313,Autre,35.88629856075339
"Coquille Saint-Jacques, BSBrieuc, Dredge, en moyenne, à l'atterrissage / FR U",conv,0,Fishery\Fishery products\Great Scallop - BSBrieuc - Dredge,0.3584438188742424,1.598218830618347,2.8807740086216236,0.7139172969024956,0.7539104147457445,0.20132191077837192,0.36545028354617787,0.4617660901089614,Autre,7.333802654195964
"Hareng de l'Atlantique, NEA, Pelagic Chalut, en moyenne, à l'atterrissage / NL U",conv,0,Fishery\Fishery products\Herring - NEA - Pelagic Trawl,0.2772935901109569,1.471079465454901,2.160038394839237,0.5360892386800593,0.570218711869511,0.07841039330011627,0.27474963295026034,0.3471693591238631,Autre,5.7150487863289055
"Maquereau Atlantique, NEA, Pelagic Chalut, en moyenne, à l'atterrissage / NL U",conv,0,Fishery\Fishery products\Mackerel - NEA - Pelagic Trawl,0.2819488997653735,1.5189154121254567,2.1801623896232663,0.5412111021357637,0.5757010056112314,0.08044230637200332,0.2773010016632892,0.3503872818171367,Autre,5.80606939911352
"Listao, la CEA, la Seine, en moyenne, à l'atterrissage / CI U",conv,0,Fishery\Fishery products\Skipjack Tuna - ECA - Seine,1.0012583234952188,4.485210888633207,8.19934480072495,2.033362240877955,2.155676854961222,0.3346242036872895,1.048210070295431,1.323623305893346,Autre,20.581310688568617
"Thon Albacore, la CEA, la Seine, en moyenne, à l'atterrissage / CI U",conv,0,Fishery\Fishery products\Yellowfin Tuna - ECA - Seine,1.0080226088900297,4.512193990732535,8.243687732683393,2.0441375513525704,2.167270197069992,0.3419205180996921,1.0537714437907333,1.3306272642183907,Autre,20.70163130683733
"Poulet, biologique, système n ° 1, à la ferme / FR U",organic,0,Agricultural\Animal production\Avian\Transformation,1.7693565215890943,2.3481212895301216,1.8413571561293023,2.986598466284931,3.285506689573212,2.898147892802692,2.4713263990346404,3.33069279455027,Viande,20.931107209494265
